이미지 주소,링크 주소,타이틀,기사내용
https://imgnews.pstatic.net/image/origin/005/2021/06/10/1446594.jpg?type=nf106_72,https://news.naver.com/main/read.nhn?mode=LSD&mid=sec&sid1=001&oid=005&aid=0001446594," 미얀마 장관 아들 식당서 난동…경찰,가해자 대신 종업원16명 구금",미얀마의 유력 실세 장관 아들이 식당에서 난동을 부렸다. 경찰은 오히려 업주와 종업원을 대거 체포해 논란이 일고 있다. 현지 매 …
https://imgnews.pstatic.net/image/origin/127/2021/06/10/31149.jpg?type=nf106_72,https://news.naver.com/main/read.nhn?mode=LSD&mid=sec&sid1=001&oid=127&aid=0000031149, [제368회 이달의 기자상] 동물방역의 표준을 만들다,"‘성화요원(星火燎原)’이란 사자성어가 있습니다. 작은 불씨가 퍼지면 넓은 들마저 태운다는 뜻으로, 이번 취재 과정을 표현하기 가 …"
https://imgnews.pstatic.net/image/origin/082/2021/06/10/1097712.jpg?type=nf106_72,https://news.naver.com/main/read.nhn?mode=LSD&mid=sec&sid1=001&oid=082&aid=0001097712, 투표 마감 앞둔 국민의힘 전대...최종 관전포인트 '빅3',"국민의힘 당 대표에 도전하는 나경원(오른쪽부터), 주호영, 조경태, 이준석, 홍문표 후보가 9일 서울 여의도 KBS에서 열린 T …"
https://imgnews.pstatic.net/image/origin/092/2021/06/10/2224535.jpg?type=nf106_72,https://news.naver.com/main/read.nhn?mode=LSD&mid=sec&sid1=001&oid=092&aid=0002224535," 시스코 웹엑스, 하이브리드 업무 맞춤형으로 재탄생",(지디넷코리아=김우용 기자)원격근무와 사무실 근무의 융합 시대를 맞아 시스코 웹엑스가 새로워졌다. 시스코시스템즈는 미래 하이브리 …
https://imgnews.pstatic.net/image/origin/079/2021/06/10/3514387.jpg?type=nf106_72,https://news.naver.com/main/read.nhn?mode=LSD&mid=sec&sid1=001&oid=079&aid=0003514387," 박범계 ""檢 조직개편안 '장관승인제' 수정 검토""",[CBS노컷뉴스 윤준호 기자] 박범계 법무부 장관이 현재 법무부에서 추진중인 검찰 조직개편안 가운데 일선 지청의 직접수사 개시  …
https://imgnews.pstatic.net/image/origin/020/2021/06/10/3363116.jpg?type=nf106_72,https://news.naver.com/main/read.nhn?mode=LSD&mid=sec&sid1=001&oid=020&aid=0003363116, 광주 철거건물 붕괴 사고 수사 본격화…‘목격자 포함’ 참고인 10명 조사,"17명의 사상자가 발생한 광주 철거 건물 붕괴 사고와 관련해, 경찰 조사가 본격화하고 있다. 광주경찰청은 국가수사본부 지침에 따 …"
,https://news.naver.com/main/read.nhn?mode=LSD&mid=sec&sid1=001&oid=056&aid=0011061002," 민주당, 인천·안산·화성 등 6곳에 ‘누구나집’ 1만 호 공급","더불어민주당 부동산특별위원회는 신혼부부, 생애최초 주택 구입자가 집값의 16%를 내고 10년 뒤 최초 공급가격에 집을 분양받는  …"
https://imgnews.pstatic.net/image/origin/030/2021/06/10/2949958.jpg?type=nf106_72,https://news.naver.com/main/read.nhn?mode=LSD&mid=sec&sid1=001&oid=030&aid=0002949958," 조폐공사-신안군, 모바일·카드형 '1004섬신안 상품권' 업무협약",한국조폐공사(사장 반장식)는 10일 전남 신안군과 '1004섬신안 상품권' 발행 및 활성화를 위한 업무협약을 체결했다. 이날 협 …
https://imgnews.pstatic.net/image/origin/028/2021/06/10/2547939.jpg?type=nf106_72,https://news.naver.com/main/read.nhn?mode=LSD&mid=sec&sid1=001&oid=028&aid=0002547939, “엄마 일어나” 일찍 잠깬 중국 아기 코끼리의 몸짓,중국 서남부 윈난성에서 7주째 북쪽으로 이동하고 있는 코끼리떼 15마리가 지난 7일 잠시 휴식을 취하고 있다. 쿤밍 부근 숲에서 …
https://imgnews.pstatic.net/image/origin/011/2021/06/10/3921596.jpg?type=nf106_72,https://news.naver.com/main/read.nhn?mode=LSD&mid=sec&sid1=001&oid=011&aid=0003921596, 3·10년물 혼합 '5년 국채선물 추종 지수' 나온다,[서울경제] 한국거래소가 3년·10년 국채선물을 혼합한 전략형 국채선물 지수인 ‘5년 국채선물 추종 지수’와 ‘5년 국채선물 추 …
